{
  "tooltips": {
    "hp_bar": "HUD_TOOLTIP_HP",
    "ap_bar": "HUD_TOOLTIP_AP",
    "move_button": "HUD_TOOLTIP_MOVE",
    "attack_button": "HUD_TOOLTIP_ATTACK",
    "end_turn_button": "HUD_TOOLTIP_END_TURN"
  },
  "combat_log": {
    "templates": {
      "player_turn": "HUD_LOG_PLAYER_TURN",
      "enemy_turn": "HUD_LOG_ENEMY_TURN",
      "round_start": "HUD_LOG_ROUND_START",
      "select_target": "HUD_LOG_SELECT_TARGET",
      "damage_dealt": "HUD_LOG_DAMAGE_DEALT"
    }
  },
  "ap_bar": {
    "segment_count": 6,
    "pip_spacing": 4.0
  },
  "turn_banner": {
    "fade_duration": 0.3,
    "slide_duration": 0.5,
    "display_duration": 1.2
  },
  "end_screens": {
    "victory": {
      "title_key": "HUD_VICTORY_TITLE",
      "summary_keys": ["HUD_SUMMARY_TURNS", "HUD_SUMMARY_KILLS", "HUD_SUMMARY_SHARDS"]
    },
    "defeat": {
      "title_key": "HUD_DEFEAT_TITLE",
      "summary_keys": ["HUD_SUMMARY_TURNS", "HUD_SUMMARY_ROOMS"]
    }
  }
}
